,text,rating_pt
2375,watch law enforcement responds washington d c amid u s capitol incident,0.0
2376,breasia terrell 11 december seen alive morning hours july 10,0.1
2377,we re told individuals including suspect transported hospital,0.0
2378,news special report officers injured suspect custody amid incident u s capitol capitol police,0.35714285714285715
2379,breaking officers injured suspect custody amid incident u s capitol capitol police,0.0
2380,happening now sabrina fulton mother trayvon martin talks derek chauvin trial concludes,0.0
2381,a landspout tornado formed near village los sosneado argentina mendoza province hail heavy,-0.05
2382,it couple friends backyard told possibly doing target practice,0.0
2383,a dozen florida new york freeze warning frost advisory,0.13636363636363635
2384,the note if congress pass bills democrats united popular presid,0.6
2385,just in rep matt gaetz communications director resigns amid probe allegations regarding gaetz sexual rel,0.5
2386,brush with the law police caught couple vandalized painting exhibition seoul the pair sa,0.0
2387,more if you officer according training you handcuff responsibilit,0.5
2388,have you trained kneel neck handcuffed head mpd ho,0.0
2389,a community rural georgia mourning death school senior killed apparen,-0.1
2390,rt pres biden raising taxes studies slow economy asking corporate america pay thei,-0.15000000000000002
2391,new pres biden decries gop opposition infrastructure proposal telling what you,0.13636363636363635
2392,breaking fully vaccinated individuals resume low risk travel cdc wear ma,0.0
2393,pres biden the benefits impact american rescue plan temporary design it rescue plan,0.0
2394,pres biden touts job report the months administration seen jobs creating,0.0
2395,you struggling actually gasp air witness witness testified told chauvin jury,0.0
2396,just in pres biden spoke ukrainian pres volodymyr zelenskyy affirmed united states unwavering suppo,0.0
2397,a series calamitous events hot heels egypt announcement transfer 22 mummies,0.25
2398,new york city mayoral candidate andrew yang hospital friday apparent kidney stone,0.09318181818181817
2399,news special report witnesses continue testify trial derek chauvin ex officer charged,0.35714285714285715
2400,two people dead plane involved gender reveal stunt crashed waters canc,-0.2
2401,we remove vigilance this blow quickly california gov gavin newsom addresses fear tha,0.3333333333333333
2402,it true grit actors yes horses carry concrete cowboy triumphant finish line,0.25
2403,confession i don clue unpack idiotic plot godzilla vs kong fourth feature,-0.3333333333333333
2404,rt new york city mayoral candidate andrew yang hospital friday apparent kidney stone,0.09318181818181817
2405,despite social distancing pandemic neighborhood creative kee,0.26666666666666666
2406,president biden unveiled sweeping infrastructure proposal expected opposition republicans but,-0.1
2407,it he terrified he suffering this cry,0.0
2408,in anomalies lockdowns shuttered hotels resorts world ship ply,0.0
2409,the european union struggling vaccination solidarity nations week negotiati,0.0
2410,u s economy added 916 000 jobs month bringing unemployment rate 6,0.0
2411,federal investigation targeting rep matt gaetz examining florida associate provided cash ot,0.0
2412,i day trepidation happen a new york couple finally reunited inside,0.06818181818181818
2413,chicago officials revealed person fatally shot officer earlier this week po,0.0
2414,one leaders thailand pro democracy movement administered intravenous fluid drip prison,0.0
2415,the initial rollout president joe biden broadly structured expensive infrastructure plan cl,-0.14583333333333334
2416,when 14 brandi levy didn varsity cut freshman cheerleader sounded social media,0.03333333333333333
2417,in beautiful things week hunter biden charts life defined tragedy addiction scandal i,0.85
2418,rt news exclusive interview christopher martin 19 reported george floyd counterfeit 20 bill manager,0.0
2419,catch me if you can dolphins spotted swimming alongside boat near miami,0.1
2420,a chinese border city hit fresh outbreak covid 19 begun five day drive vaccinate entire popula,0.09999999999999999
2421,as coronavirus forced people stay close home citizen scientists providing invaluable dat,-0.30000000000000004
2422,federal investigation targeting rep matt gaetz examining florida associate provided cash ot,0.0
2423,rescuers help survivors wreck train crashed taiwan killing 36 people injuring ove,0.0
2424,an ice detention center eloy arizona violation multiple detention standards health,-0.05
2425,update the death toll taiwan worst rail disaster decades risen 41 officials,-1.0
2426,a shopper returned car thousands bees residence absence the animals wer,-0.0125
2427,mental health experts warn derek chauvin trial revive feelings racial trauma,-0.1
2428,fda authorizes home counter rapid coronavirus tests easy buy perform,0.43333333333333335
2429,the virginia supreme court ruled charlottesville remove statues confederate generals civil,0.0
2430,as world watches trial former police officer derek chauvin death george floyd 2020 floyd,0.0
2431,at 36 people reported dead passenger train derailed tunnel near city hualien easte,-0.05
2432,early covid 19 testing key reducing mortality rates inmates according report,0.05
2433,an orthodox jewish couple visiting new york city toddler slashed knife,-0.02121212121212122
2434,chicago mayor lori lightfoot city won vaccine 16 rest,0.0
2435,parents lgbtq advocates speak arkansas bills targeting transgender rights,0.0
2436,a california mom created mobile app protect black drivers event pulled police,-0.16666666666666666
2437,as eligibility test america vaccine hesitancy,0.0
2438,human remains found rural iowa week belong 10 girl missing nine month,-0.06666666666666667
2439,toddler receives own mini ups truck delivery drivers waves day,0.6
2440,asian americans escalating fears discrimination harassment pandemic solidify,0.0
2441,britney spears breaks silence seeing new york times documentary framing britney spears,0.06818181818181818
2442,wall of hearts london mural commemorates lives lost covid 19 pandemic,0.0
2443,a north carolina police officer resigned video surfaced mistreating k 9 training,0.0
2444,a community rural georgia mourning death school senior killed apparen,-0.1
2445,hennepin county district court judge peter cahill informed jurors sequestered,0.0
2446,farmworker advocates racing time vaccinations migrant workers newly eligible jab,0.13636363636363635
2447,just in federal investigation targeting rep matt gaetz examining florida associate provided,0.0
2448,a fire pig breeding facility northeastern germany believed killed 55 000 animals,-0.2
2449,the fund strengthening media literacy skills supporting checkers resea,0.25
2450,hilary duff shared photo daughter mae week giving birth,0.0
2451,chrissy teigen reflecting racism faced growing impact upbringing career,0.0
2452,beyonc giving world rare glimpse growing twins rumi sir,0.3
2453,let play baseball snow doesn stop thousands fans enjoying day detroit,0.5
2454,i confident justice served terrence floyd george floyd brother discusses derek chauvin trial,0.5
2455,hailey bieber candidly spoke social media impact mental health deleted twitter acco,0.17777777777777778
2456,two people dead plane involved gender reveal stunt crashed waters canc,-0.2
2457,a graphic novel kids shelves publisher calls passive racism,0.0
2458,the oscar winner honored dad penning heartbreaking tribute calling gentle,0.2
2459,mental health experts warning watching derek chauvin trial profound emotional psycholog,-0.005555555555555559
2460,new construction migrant processing facility donna texas seen exclusive aerial view sprawl,0.13636363636363635
2461,i chad wouldn stop,0.0
2462,a little girl belting popular selena songs car dad getting love millions,0.30416666666666664
2463,the women movement seen doctors targeted providing necessary medical care services,0.0
2464,climate change causing cherry blossom trees world blossom earlier pa,0.0
2465,linkedin soon allow parents add stay home mom stay home dad titles sum,0.0
2466,both vanessa bryant daughter natalia jumping joy recent college acceptance letter,0.4
2467,an ice detention center eloy arizona violation multiple detention standards health,-0.05
2468,egypt expecting 1 billion compensation cargo ship blocked suez canal nearly week,0.1
2469,new yorkers northeastern awoke snow winter blast moved eastern,0.13636363636363635
2470,keep your distance police patrol banks river seine paris remind people coronavirus res,0.0
2471,we remove vigilance this blow quickly california gov gavin newsom addresses fear tha,0.3333333333333333
2472,on this day 45 ago apple computer founded steve jobs steve wozniak ronald wayne,0.0
2473,a suez canal blockage trains colliding garment factory blaze building collapse heels,0.0
2474,a holy thursday service paris held notre dame cathedral construction,0.0
2475,with hopes rising powerful rebound hiring this friday jobs report march provide crucial i,0.15
2476,an orthodox jewish couple visiting new york city toddler slashed knife,-0.02121212121212122
2477,this season mlb record 23 female coaches lineup field professional developm,0.05
2478,catch me if you can dolphins spotted racing boat miami florida,0.0
2479,while offense lil nas x music video montero adam lambert celebs defending,0.0
2480,over thousand vulnerable people living rome receive vaccination coming days,-0.5
2481,virginia supreme court rules charlottesville remove statues confederate generals civil,0.0
2482,our feminism unapologetically expansive leave door future generations le,0.0
2483,covid 19 unaccompanied migrant children facilities spark concerns crowding,0.0
2484,rt covid ravages brazil reports vila formosa largest cemetery s paulo brazil crews ar,0.0
2485,fans players battled cold weather including snow fans engaged ballpark mlb teams kicked,-0.6
2486,senate minority leader mitch mcconnell urges fellow republicans vaccinated covid 19 visi,0.0
2487,i day trepidation happen a new york couple finally reunited inside,0.06818181818181818
2488,sabra recalling thousands classic hummus routine fda screening discovered potential salmonel,0.08333333333333333
2489,there trend vaccine acceptance pollsters finding somewhat agreement abso,0.0
2490,chicago mayor lori lightfoot city won vaccine 16 rest,0.0
2491,a handful coins unearthed pick own fruit orchard rural rhode island corners new engl,0.24545454545454545
2492,fda authorizes home counter rapid coronavirus tests easy buy perform,0.43333333333333335
2493,to the rescue this bystanders praised banding help save family burning,0.0
2494,for this couple los angeles decision debt love sacrifice,0.5
2495,biden administration announces effort combat vaccine hesitancy dispel misinformation employ,0.0
2496,authorities investigating fire truck collided vehicle then crashed gas station detroit,0.0
2497,one mom created mobile app protect black drivers event pulled police,-0.16666666666666666
2498,latest the shooting appears isolated incident suspect business personal relations,0.25
2499,allyship anti racism aren listening changing via,0.0
2500,the derek chauvin trial exposes emotional trauma survivor guilt expressed eyewitnesses whom,0.0
2501,rt from i i i didn breathing movement paramedic witness te,0.0
2502,america cities spent range 3 billion police misconduct settlements decade what,-0.1
2503,human remains found rural iowa week belong 10 girl missing,-0.06666666666666667
2504,data 32 prison systems found 1 3 inmates tested positive virus according report,0.22727272727272727
2505,general motors recalls 10 000 vans due fire risk recommending owners park outdoors awa,-0.03749999999999999
2506,california gov newsom receives johnson amp johnson covid 19 vaccine,0.0
2507,with march madness swing ncaa faced former college athletes supreme cour,0.0
2508,japan designates osaka virus control steps infections rise mont,0.0
2509,after reaching trigger white house aapi representation pres biden cabinet sen tammy,0.0
2510,opening day baseball game nationals mets postponed hours scheduled begin,-0.4
2511,google contribute 29 million newly formed goal combatting misinf,0.13636363636363635
2512,russian opposition leader alexey navalny declares hunger strike prison protest authorities,0.0
2513,pres joe biden hold cabinet meeting this afternoon white house day announcing,0.0
2514,pfizer covid 19 vaccine 100 effective children ages 12 15 experts ensuring vaccines,0.6
2515,a massive blaze compton california engulfed pallet yard prompting authorities evacuate surrounding,0.0
2516,spain madrid region halts covid 19 vaccinations health centers days medical staff rest th,0.0
2517,the organizers 2022 beijing winter olympics started 10 days testing hockey indoor venue,0.0
2518,a police officer salisbury north carolina resigned video surfaced mistreating k 9 duri,0.0
2519,angry octopus a surprising slap run cranky cephalopod,0.09999999999999998
2520,facing mounting pressure delta air lines coca cola chief executives forcefully georgia,0.0
2521,we sons i and this person i pray you,0.0
2522,easter egg hunt meerkats squirrel monkeys london zoo enjoyed easter egg hunt painted eggs filled,0.45
2523,former air force intelligence analyst pleads guilty leaking classified documents reporter military dr,-0.19999999999999998
2524,news special report witnesses continue emotional testimony trial derek chauvin ex officer charged,0.17857142857142858
2525,thousands people vaccinated covid 19 mass inoculation event puerto rico capital,0.0
2526,seeking overcome vaccine hesitancy biden administration unveiling coalition community religious,0.0
2527,weather a winter blast moving eastern u s storm system brought flash flooding st,0.0
2528,u s border patrol agents rescued toddlers smugglers dropped top barrier approximately 14 fee,0.04999999999999999
2529,nan,0.0
2530,pres biden 3 german shepherd major doghouse biting incident required,0.03125
2531,covid 19 unaccompanied migrant children facilities spark concerns crowding,0.0
2532,wall of hearts londoners mural commemorate lives lost covid 19 pandemic,0.0
2533,on the move super pod dolphins spotted southern california coast gracefully swimming alongside wha,0.16666666666666666
2534,starting now headlines globe anchors,0.0
2535,what jurors derek chauvin trial,0.0
2536,matt gaetz controversial rise maga stardom renewed scrutiny amid doj probe,0.55
2537,as majority adults country sit cusp eligibility covid 19 vaccines u s,0.0
2538,the goggles project 3d terrain maps soldiers directly front allowing troops,0.1
2539,huge inflatable pink cake candles spouting rainbow flames glides amsterdam canals dutch,0.15000000000000002
2540,the pregnancy diagnosed superfetation phenomenon pregnancy occurs initial,0.0
2541,special delivery ups drivers surprise toddler own mini delivery truck,0.47857142857142854
2542,mental health experts warning watching derek chauvin trial profound emotional psycholog,-0.005555555555555559
2543,it feeling demeaned feeling powerlessness father,0.0
2544,smugglers caught camera dropping young children top 14 foot border fence separating u,0.3
2545,pres biden unveils sweeping infrastructure plan calling generation investment america,0.0
2546,pregnant while already pregnant mom birth rare super twins born day conceived weeks,0.32499999999999996
2547,former air force intelligence analyst pleads guilty leaking classified documents reporter military dr,-0.19999999999999998
2548,new york 15th allow recreational marijuana adults,0.13636363636363635
2549,confronted compelling video photographic evidence court dozens rioters apologized expresse,0.3
2550,sabra recalling thousands classic hummus routine fda screening discovered potential salmonel,0.08333333333333333
2551,two capitol police officers file civil suit former pres trump physical emotional injuries,0.0
2552,no democratic senator beholden party senior senator west virginia,0.0
2553,u s border patrol agents rescued toddlers smugglers dropped top barrier approximately 14 fee,0.04999999999999999
2554,soothing sight a view tour boat cherry blossom japanese city kyoto beautiful,0.425
2555,over thousand vulnerable people living rome receive vaccination coming days,-0.5
2556,the 2022 midterm elections decide controls u s senate house crucially party,0.0
2557,the state department essential u s government employees family evacuate myanm,0.0
2558,russian opposition leader alexey navalny declares hunger strike prison protest authorities,0.0
2559,pfizer covid 19 vaccine 100 effective children ages 12 15 experts ensuring vaccines,0.6
2560,federal investigation rep matt gaetz focused allegations sexual relationship,0.5
2561,gop rep mariannette miller meeks certified winner november mere six votes 400 000 cast mar,-0.5
2562,serial killer joseph edward duncan iii died federal prison recently admitted killing seven people,0.0
2563,pres biden 3 german shepherd major doghouse biting incident required,0.03125
2564,california gov newsom orange county shooting left people dead including child horri,-0.1
2565,flipped out truck driver video captures moment semi lost control icy canadian highway,-0.1
2566,latest suspect female victim transported hospital critical condition authorities shooting le,0.10625
2567,the oscar winner honored dad penning heartbreaking tribute calling gentle,0.2
2568,to the rescue this bystanders praised banding help save family burning,0.0
2569,pres biden speaking night mlb ballparks reopen fans throughout country called mistake,0.0
2570,in notice sent congress blinken china continued dismantle hong kong autonomy predec,0.0
2571,there trend vaccine acceptance pollsters finding somewhat agreement abso,0.0
2572,authorities investigating fire truck collided vehicle then crashed gas station detroit,0.0
2573,allyship anti racism aren listening changing via,0.0
2574,first lady jill biden urged california farmworkers vaccinated praised persistence amid pandemi,0.25
2575,this endangered spectacled bear wild rescued suffering malnutrition wil,0.1
2576,an officer involved shooting situation stabilized threat publi,0.0
2577,developing at people dead including child shooting orange county california authorit,-0.2
2578,facing mounting pressure delta air lines coca cola chief executives forcefully georgia,0.0
2579,general motors recalls 10 000 vans due fire risk recommending owners park outdoors awa,-0.03749999999999999
2580,the women movement seen doctors targeted providing necessary medical care services,0.0
2581,the biden administration quietly ramping assistance palestinians former pres trump cut near,0.03333333333333333
2582,as coronavirus forced people stay close home citizen scientists providing invaluable dat,-0.30000000000000004
2583,with march madness swing ncaa faced former college athletes supreme cour,0.0
2584,people 21 virginia legally possess grow amounts marijuana beginning july ch,0.2
2585,after reaching trigger white house aapi representation pres biden cabinet sen tammy,0.0
2586,rt religious leaders build trust covid 19 vaccine communities color co anchor report,0.0
2587,as lil nas x continues blur lines hip hop country music internet troll global star mor,0.0
2588,both vanessa bryant daughter natalia jumping joy recent college acceptance letter,0.4
2589,as americans vaccinated increasing covid 19 impacting adults pro,0.0
2590,the fund strengthening media literacy skills supporting checkers resea,0.25
2591,a super pod dolphins raced coast dana point california rushing alongside whale watching boat,0.3333333333333333
2592,covid 19 unaccompanied migrant children facilities spark concerns crowding,0.0
2593,climate change causing cherry blossom trees world blossom earlier pa,0.0
2594,pres biden unveils massive infrastructure plan calling generation investment america unlike,0.0
2595,there handful trans athletes five trans male athletes trans gi,0.0
2596,a graphic novel kids shelves publisher calls passive racism,0.0
2597,former air force intelligence analyst pleads guilty leaking classified documents reporter military dr,-0.19999999999999998
2598,it time build economy bottom middle top that hasn ve,0.25
2599,rt pres biden proposed infrastructure plan it bold yes and,0.3333333333333333
2600,sabra recalling thousands classic hummus routine fda screening discovered potential salmonel,0.08333333333333333
2601,ice piled shores lakes minnesota amid wind gusts 40 miles hour otter tail county,0.0
2602,u s border patrol agents rescued toddlers smugglers dropped top barrier approximately 14 fee,0.04999999999999999
2603,new federal investigation rep matt gaetz focused allegations sexual relationship leas,0.3181818181818182
2604,rt pres biden plan rebuild backbone america it vision seen eyes wall street w,0.0
2605,russian opposition leader alexey navalny declares hunger strike prison protest authorities,0.0
2606,as trans people tech workplaces feel saf,0.0
2607,rt starting now pres biden delivers remarks economic plan pittsburgh,0.1
2608,rare treat a whale watching 12 minute encounter salmon shark spotted near californi,0.2
2609,i feel helpless a witness breaks tears watching video george floyd arrest derek c,-0.05
2610,coming up pres biden set unveil roughly 2 trillion infrastructure plan modernize thousands miles,-0.1
2611,britney spears breaks silence seeing new york times documentary framing britney spears,0.06818181818181818
2612,civil rights sue georgia changes voting laws harder people vote particularl,-0.1
2613,it wrong harmful asian readers friends family asian people author,-0.16666666666666666
2614,watch live witnesses stand trial derek chauvin ex officer charged death george floyd,0.13636363636363635
2615,aniol serrasolses kayaked snowy mountain including stretch forms villarrica volcano,0.0
2616,pentagon sweeps trump era policies banned transgender people serving military wil,-0.1
2617,the u s american diplomats loved ones evacuate myanmar amid escalating violence,0.35
2618,a study national institute allergy infectious diseases provided strong evidence coronavi,0.4333333333333333
2619,new york legislature formally votes legalize regulate recreational marijuana adults expunge th,0.13636363636363635
2620,i feel helpless a witness breaks tears watching video george floyd arrest derek c,-0.05
2621,during emotional testimony duty firefighter scene george floyd arrest totally distr,-0.016666666666666666
2622,adorable addition an aquarium new zealand welcomed king penguin chick launching competition name th,0.3181818181818182
2623,home camera footage ef 3 tornado ripped eagle point alabama thursday suddenly appr,0.0
2624,watch live witnesses stand trial derek chauvin ex officer charged death george floyd,0.13636363636363635
2625,rt historically anti asian attacks underreported various reasons including language barriers distrust governm,0.0
2626,two capitol police officers file civil suit former pres trump physical emotional injuries,0.0
2627,militia extremists developing strategies social media crackdown dhs memo warns,0.03333333333333333
2628,anyone previously convicted possessing amount marijuana legal limit automatically su,0.016666666666666677
2629,a study national institute allergy infectious diseases provided strong evidence coronavi,0.4333333333333333
2630,new the covid 19 increased 10 26 washington d c puerto rico,0.13636363636363635
2631,pfizer covid 19 vaccine 100 effective children ages 12 15 experts ensuring vaccines,0.6
2632,read,0.0
2633,rt this significant impact perception ability gain access polls we don support,0.375
2634,rt george motionless limp chauvin resting meaning rested knee hi,-0.2
2635,facing mounting pressure delta air lines chief executive decries georgia sweeping elections bill calling,0.0
2636,new volkswagen issues statement false news release saying changed name u s subsidiary vo,-0.13181818181818186
2637,rep matt gaetz denies sexual relationship underage girl amid reports doj investigation,0.5
2638,prince harry meghan married public wedding archbishop confirms,0.125
2639,french president emmanuel macron scheduled televised address nation harbinger tighter,0.0
2640,the who team report origins coronavirus facing barrage questions issues access,0.0
2641,the archbishop canterbury clarifies comments prince harry duchess meghan bombshell interview,0.0
2642,a volcano guatemala spewed ash molten rock sky eruption sent ash plumes 12 300,0.0
2643,rt we taking mitigation measures wearing mask social distancing continue,0.03333333333333333
2644,rt senate majority leader chuck schumer decriminalizing marijuana i support decriminalization federal level,0.0
2645,soothing sight a view tour boat cherry blossom japanese city kyoto beautiful,0.425
2646,reports ethnic kachin guerrillas attacked police outpost northern myanmar indication,0.0
2647,watch live witnesses stand trial derek chauvin ex officer charged death george floyd,0.13636363636363635
2648,come buddy you this dramatic footage captured officers saving burning car,-0.4333333333333333
2649,check list april arrivals streaming service,0.0
2650,major nipped national park service employee white house south lawn monday afternoon lady jill,0.03125
2651,iran aligned shiite militias posing increasing challenge iraq ahead key talks washington ar,0.0
2652,across country tens millions americans received tangible bill health following vaccinations,0.0
2653,the pandemic dealt blow london tourism industry employs seven capital workers,0.0
2654,wisconsin supreme court strikes gov tony evers statewide mask mandate,0.0
2655,rt being black woman you raise bar yourself half ucla gym,-0.16666666666666666
2656,the convicted murderers garnered army internet defenders tiktok,0.0
2657,the 2022 midterm elections decide controls u s senate house crucially party,0.0
2658,a judge filmed dying police officers crash scene describing justice pro,0.0
