,text,rating_pt
605,new delhi weeklong lockdown explosive surge coronavirus pushes india capital,0.13636363636363635
606,new pres biden as american eligible receive covid 19 vaccine for yourself neig,0.06818181818181818
607,residents evacuated cape town neighborhoods huge fire spreading slopes city,0.4000000000000001
608,rt the biden administration abruptly closed shelter unaccompanied migrant girls this weekend sources tell wer,-0.1
609,the capital city mississippi clean water nearly month some jackson residents spoke wit,0.23333333333333334
610,i beautiful home beautiful children i taking break i enjoying,0.7333333333333334
611,starting now headlines globe anchors,0.0
612,while isn stop robocalls completely fcc you stop mos,0.1
613,black women birth twice white women experience infertility,-0.08333333333333333
614,unbearable conditions push biden administration close houston migrant center news,-0.1
615,the team reaction nasa jet propulsion laboratory ingenuity helicopter launched atm,0.0
616,their mating songs reach 90 decibels,0.0
617,nasa launches ingenuity helicopter atmosphere mars marking powered controlled flight,0.0
618,perseverance mars with ingenuity soar nasa experimental mars helicopter makes,0.1
619,people survey devastation wrought san francisco earthquake 115 ago this,0.0
620,just in nasa experimental mars helicopter rose dusty red surface thin air achieving,-0.020000000000000018
621,closing arguments set begin derek chauvin murder trial death george floyd,0.0
622,the announcement comes days navalny physician health deteriorating rapidly 44,0.0
623,some women describing temporary changes menstrual cycles taking covid 19 vaccine experts,0.0
624,it marks tentative steps countries hope gradual reopening rest,0.0
625,after prom graduation canceled held virtually covid 19 pandemic lockdowns sc,0.0
626,i found hard believe i especially age,-0.14583333333333334
627,tennessee woman called police physical fight involving daughter girl boyfriend befor,0.0
628,police suburban minneapolis shoot kill allegedly involved carjacking fired shots pur,-0.05
629,the biden administration shuttered houston facility housed hundreds unaccompanied migrant children amid,0.0
630,vandals left pig head time california home force expert testified behalf,0.0
631,there indication driver seat,0.0
632,if derek chauvin found guilty killing george floyd set precedent policing be,-0.5
633,a suspected poacher killed herd breeding elephants encountered fleeing park rangers,-0.2
634,the u s china world biggest carbon polluters agreed cooperate curb climate change,0.0
635,a wildfire raging slopes cape town table mountain spread university cape town burning hi,0.0
636,the former home expert police force witness testified defense derek chauvin murder,0.0
637,a woman served 10 sentence u s prison lying role 1994 rwandan genocide,0.0
638,the findings suggest noise pollution mere nuisance via,-0.5
639,katy perry mince words expressing feelings social media,0.03333333333333333
640,the who global infection rate approaching,0.0
641,u s water officials projecting lakes store water throughout american west fall,0.0
642,half americans age 18 received covid 19 vaccination shot according cdc,-0.16666666666666666
643,both supporters detractors boasted strong quarter fundraising,0.4333333333333333
644,i robbed 36 life i twin but time i gra,0.0
645,pope francis voiced apprehension recent russian troop buildup near border ukraine,0.03333333333333333
646,teach on the beach after remote learning socially distanced classrooms this school moving lesson,-0.03333333333333334
647,the consumer product safety commission issued urgent warning people stop using peloton tread tre,0.0
648,a 7 girl killed 29 seriously injured shooting outside fast food restaura,-0.08333333333333333
649,teddy ballgame teddy blockchain,0.0
650,the moves government wide effort biden administration address climate change,-0.1
651,the national world war i memorial washington d c marking national memorial commemorating,0.0
652,they called community path resistance,0.0
653,students staff lined hallways prairie vale elementary school celebrate cafeteria manager yanet lopez,0.3
654,first steps zookeepers wisconsin welcomed 94 pound male bactrian camel calf wobbled habitat,0.125
655,a wildfire raging slopes cape town table mountain spread university cape town burning hi,0.0
656,their mating songs reach 90 decibels,0.0
657,dr fauci told decision lift suspension administering johnson amp johnson vaccine,0.0
658,marines training seafaring tanks time nine died troop carriers sank,0.0
659,all systems nasa plans history red planet,0.0
660,there indication driver seat,0.0
661,on reaching goal true equality civil rights attorney ben crump what look,0.35
662,a suspected poacher killed herd breeding elephants encountered fleeing park rangers,-0.2
663,welcome to the world a porcupine named betty white saco river wildlife center adorable porcupette,0.30000000000000004
664,sec state antony blinken defends pres biden pledge withdraw troops afghanistan we afghanis,-0.1
665,new texas authorities suspect former deputy loose considered armed dangerous,-0.13513986013986012
666,as daunte wright death tears wounds police departments change,0.0
667,there growing international concern jailed russian opposition leader alexey navalny team warned i,0.0
668,the former northern california home expert police force witness testified week defens,0.0
669,pres biden plans lift predecessor historically low cap refugees month,0.0
670,vaccinations near hit herd immunity quickly spreading potentiall,0.21666666666666667
671,here fatal police shooting 13 adam toledo,0.0
672,half americans 18 received covid 19 vaccination shot according data released sunday,-0.16666666666666666
673,former secretary state mike pompeo wife susan violated federal ethics rules assigning staff personal,0.0
674,veterinarians increased risk suicide amid pandemic reports,0.0
675,jerry falwell jr decries liberty university hostility school files 10m suit,0.0
676,activists imprisoned russian opposition leader alexei navalny calling massive protests heart,0.0
677,historically black colleges universities played pivotal role developing powerful lea,0.2111111111111111
678,meteorologist receives outpouring support posting social media hearing aids,0.03333333333333333
679,what you doing this german shepherd scared overnight storms hid owner,0.0
680,latest at 11 people died 98 injured passenger train derailed banha egypt health mi,0.5
681,what fatal police shooting daunte wright,0.0
682,lawsuits pile endangered species decisions trump administration,0.0
683,developing three people killed authorities calling active shooter incident austin tex,-0.16666666666666669
684,swim free a dozen magellanic penguins waddled chilly seas coast argentina rehab,-0.09999999999999998
685,russia moves outlaw navalny movement doctors plead access prison,0.0
686,a woman served 10 sentence u s prison lying role 1994 rwandan genocide,0.0
687,dust devil a softball team watched dust devil spin field alabama school practice befo,0.0
688,we land ancestors left black community memphis resists propo,-0.08333333333333333
689,one person dead missing barge crashed pleasure craft ohio river lou,-0.2
690,because living rely noise pollution actually stop forests growing,0.0
691,artist maliha abidi highlights six women saving planet you,0.0
692,unwelcome visitor curious bear chased southern california home fierce terriers,-0.05
693,developing a passenger train traveling cairo al mansoura egypt derailed at 100 people injur,0.0
694,attorneys trump accuser e jean carroll court doj defending,0.0
695,some people charged storming u s capitol jan 6 claiming record history,0.0
696,in full bloom cherry blossoms lined streets bonn germany officials patrol kept visito,0.35
697,dwyane wade nba owner,0.0
698,a sentenced months federal prison shooting elephant seal head handg,0.0
699,pope francis voiced apprehension recent russian troop buildup near border ukraine called ef,0.03333333333333333
700,rhinos bedfordshire ready celebrate reopening zoos england enjoying breakfast crashing,0.35
701,rt exclusive sec state antony blinken defends pres biden pledge withdraw troops afghanistan we afgh,-0.1
702,rt we legacy sacrifices worth as pres biden pledges withdraw u s,0.3
703,the justice department sues former trump campaign adviser roger stone wife nydia 2 million unpaid,0.1
704,on reaching goal true equality civil rights attorney ben crump look,0.35
705,germany remembers nearly 80 000 dead covid pandemic,-0.05
706,rt ahead chauvin trial closing arguments civil rights attorney benjamin crump hopes derek chauvin held,0.0
707,take minute day enjoy this timelapse footage peaceful sunrise chicago rainbow beach,0.325
708,key takeaways derek chauvin trial george floyd death jurors near deliberation,0.05
709,japan prime minister u s drug maker pfizer additional supplies covid 19 vaccine,0.0
710,developing three dead seriously injured morning shooting bar wisconsin authorities the,-0.26666666666666666
711,weather severe storms florida milder weather returns east coast,0.0
712,erin tokley 565 000 americans die covid 19,0.0
713,safety regulators warned people kids pets saturday immediately stop using treadmill peloton,0.0
714,new pandemic restrictions imposed canada populous province immediately run opposition,0.13636363636363635
715,myanmar junta released 23 000 prisoners attend regional summit,0.0
716,iran named suspect attack natanz nuclear facility damaged centrifuges saying fle,0.0
717,u s climate envoy john kerry met south korea foreign minister seoul talks ahead virtual climate,-0.125
718,iran named suspect attack natanz nuclear facility damaged centrifuges saying fle,0.0
719,what fundraising quarter signals 2022 senate map,0.0
720,the united auto workers union calling general motors pay union wages electric vehicle battery,0.05000000000000002
721,prisons postpone vaccinations johnson amp johnson shots paused,0.0
722,how environmental racism continues affect communities color,0.0
723,the global death toll coronavirus topped staggering million people amid repeated setbacks,0.0
724,the rapper continues poke fun outrage this time line merch,0.3
725,fundraising reports offer glimpse potential contenders stand,0.0
726,charles geschke co founder major software company adobe inc developer pdfs died age 81,0.0625
727,adam toledo remembered family funny teen wake fatal police shooting,0.125
728,the defense expert derek chauvin trial federal lawsuit death died circum,0.0
729,scientists believe combat deadly variants future pandemics,-0.1
730,it re 90s anymore i tell people switch light bulbs,0.4
731,regulators massachusetts trying effectively bar popular robinhood trading app,0.6
732,adam toledo remembered family funny teen wake fatal police shooting,0.125
733,pulse oximeters medical devices battling covid 19 effectively people color according,0.3
734,republican lawmakers reintroduced legislation ban video sharing app tiktok government devices,0.0
735,as levels depression rise public health experts typically expect suicide rates follow but studies,-0.08333333333333333
736,ralph lauren fans look team usa sporting tokyo olympics closing ceremony,0.0
737,house committee advances bill create commission study recommendations provid,0.0
738,protests unfolded tennessee friday demands police release body camera footage officer involved,0.0
739,emergency landing a world war ii era plane participating cocoa beach air show safely emergency land,0.5
740,the supreme court hear oral arguments monday determine eligible 530,0.0
741,daunte wright highlights challenge police reaching stun guns experts,0.0
742,in recent officers faced little consequences deemed mistake,-0.09375
743,despite increase depression pandemic suicides decreased studies,-0.4
744,more 200 honduran migrants stepped six buses converted seaside hotel this week following wearying,0.25
745,video asian woman pushed ground robbed gunpoint san francisco,0.0
746,a doctor imprisoned russian opposition leader alexey navalny third week hunger strike,0.0
747,amid mounting anger allegations bullying broadway hollywood producer scott rudin broke silence sat,-0.7
748,some journalists covering protests police shooting suburban minneapolis police harassed des,0.0
749,while isn stop robocalls completely fcc you stop mos,0.1
750,prisons postpone vaccinations johnson amp johnson shots paused,0.0
751,babies born black women u s times infant mortality rate babies born hispanic whit,-0.16666666666666666
752,everyone shock fear coming empowerment brutal taliban killing inn,-0.875
753,larger community action organizing voting truly lead changes cli,0.05
754,independents lean party tend party rate openly partisan voters,0.0
755,of roughly 7 million people safely vaccinated single dose vaccine johnson amp johnson,0.10952380952380954
756,this unfortunate error,-0.5
757,blood donations supply levels reached alarming lows blood centers increased demand,-0.1
758,at dr fauci told rep jordan i you re this personal isn it,0.0
759,on the prowl a resident estes park colorado spotted wild bobcat treading wintry landscape,0.1
760,toyota recalling nearly 280 000 venza suvs u s wiring stop air bags,0.1
761,a blended family adorable tiger cubs amur tigers malayan tiger played th,0.5
762,the consumer product safety commission issued urgent warning people stop using peloton tread tre,0.0
763,at start derek chauvin murder trial killing george floyd defense attorney eric nelson,0.0
764,teachers students this maryland schoolers decided,0.0
765,tiny tesla toy cars eco makeover inspire kids environmental impact driving,0.0
766,doctors scientists public health experts europe clues similar vaccine astr,0.0
767,honolulu police released body camera footage officers deployed stun gun black fata,-0.16666666666666666
768,a black gray manta ray glides water unusually close shore near st petersburg florida wi,0.04444444444444445
769,new pandemic restrictions imposed canada populous province immediately run opposition,0.13636363636363635
770,queen elizabeth life ahead funeral husband 73 prince philip,0.0
771,we land ancestors left black community memphis resists propo,-0.08333333333333333
772,welcome to the world florida brevard zoo introduces baby toed sloth,0.8
773,rt as federal health agencies continue recommending pause administering j amp j vaccine talks dr ant,0.0
774,erin tokley 565 000 americans die covid 19,0.0
775,safety regulators warned people kids pets saturday immediately stop using treadmill peloton,0.0
776,down they go more 15 000 boxes cereal collected students florida school districts toppled,0.17222222222222222
777,a proposed 49 mile crude oil pipeline connecting refinery memphis existing pipeline marshall county,-0.7
778,flipping free a loggerhead turtle hatchling makes ocean beneath spectacular australian sunset,0.3333333333333333
779,latest following roughly 50 minute funeral service prince philip interred royal vault st george,0.13333333333333333
780,members royal family seen seated st george chapel funeral service prince philip du,0.0
781,updated model evaluates red bull mercedes this season,0.0
782,takes look queen elizabeth ii prince philip american presidents throughout,0.0
783,we want democracy faced heavy security inside towns protesters demonstrate anti coup messag,-0.2
784,queen elizabeth ii sitting st george chapel husband prince philip funer,0.0
785,queen elizabeth ii seen wearing mask seated st george chapel service husband prince phil,0.0
786,queen elizabeth ii arrives funeral late husband prince philip duke edinburgh st george cha,-0.3
787,latest only people speaking prince philip service dean windsor archbishop canterbur,0.25
788,prince philip coffin carried steps st george cathedral,0.0
789,meghan sent handwritten note harry sent wreath laid philip duke edinburgh,0.0
790,prince philip family including princess anne princes charles andrew edward william harry follow prince,0.0
791,the sky beijing shrouded orange haze sandstorm hit city officials issued aler,0.0
792,queen elizabeth ii arrives st george chapel funeral late husband prince philip,-0.3
793,princes william harry brothers odds past differences aside,-0.25
794,princes charles william harry seen procession prince philip st george chapel,0.0
795,prince philip procession st george chapel underway route lined military services,-0.1
796,rt 1st battalion grenadier guards hold prince philip coffin,0.0
797,reports love story queen elizabeth ii prince philip he ha,0.5
798,news special report reports funeral britain prince philip set begin sho,0.35714285714285715
799,fundraising reports offer glimpse potential contenders stand,0.0
800,weather strong storms expected this weekend south flooding rain hail gusty winds th,0.16666666666666663
801,live updates the funeral britain prince philip husband queen elizabeth ii set begin 3,0.13636363636363635
802,fresh eruption a st vincent captured scene la soufri re volcano erupted wednesday,0.3
803,nearly 100 people arrested friday night brooklyn center minnesota following protests death,0.0
804,the global death toll coronavirus topped staggering million people amid repeated setbacks,0.0
805,as levels depression rise public health experts typically expect suicide rates follow but studies,-0.08333333333333333
806,what fundraising quarter signals 2022 senate map,0.0
807,how environmental racism continues affect communities color,0.0
808,one hint create nursing cart,0.0
809,police chicago illinois clash protesters demonstrations 13 adam toledo following,0.0
810,queen elizabeth life ahead funeral husband 73 prince philip,0.0
811,identical twins separated birth reunited 36,0.0
812,prisons postpone vaccinations johnson amp johnson shots paused,0.0
813,the united auto workers union calling general motors pay union wages electric vehicle battery,0.05000000000000002
814,despite increase depression pandemic suicides decreased studies,-0.4
815,we conscience provide economic support government enacts regressive voting laws,0.2
816,fans late mister rogers lifetime opportunity live home inhabited,-0.08181818181818182
817,the rapper continues poke fun outrage this time line merch,0.3
818,ralph lauren fans look team usa sporting tokyo olympics closing ceremony,0.0
819,the nonsense vehicle customized direction military green color,-0.15000000000000002
820,a global epidemic digital extortion ransomware crippling local governments hospitals school distri,0.0
821,the johnson amp johnson pause system via,0.0
822,2 5 billion tyrannosaurus rex probably roamed earth course couple million study,0.0
823,childhood friends restaurant exclusively employs formerly incarcerated individuals,0.0
824,in recent officers faced little consequences deemed mistake,-0.09375
825,vin diesel recently shared believes this casting move message late friend co star pa,-0.15
826,this unfortunate error,-0.5
827,babies born black women u s times infant mortality rate babies born hispanic whit,-0.16666666666666666
828,at dr fauci told rep jordan i you re this personal isn it,0.0
829,dwyane wade nba owner,0.0
830,pres biden russia sanctions i pres putin gone i chose,0.0
831,attorneys trump accuser e jean carroll court doj defending,0.0
832,jerry falwell jr decries liberty university hostility school files 10m suit,0.0
833,fierce beijing critic jimmy lai jailed 14 months hong kong pro democracy protests,0.0
834,dwayne johnson believes life changing handshake,0.0
835,meteorologist receives outpouring support posting social media hearing aids,0.03333333333333333
836,the eight victims mass shooting indianapolis fedex facility identified they ranged age,0.0
837,i definitely panicked bit,0.0
838,former president donald trump influence gop tested 2022 fundraising,0.0
839,we spoke experts fields surrounding environment environmental policy wha,0.0
840,russia moves outlaw navalny movement doctors plead access prison,0.0
841,vaccinations near hit herd immunity quickly spreading potentiall,0.21666666666666667
842,interior sec deb haaland revokes series trump administration promoted fossil fuel development,-0.1
843,with months left tokyo olympics set begin japan top officials suggeste,0.25
844,here fatal police shooting 13 adam toledo,0.0
845,the justice department sues former trump campaign adviser roger stone wife nydia 2 million unpaid,0.1
846,what fatal police shooting daunte wright,0.0
847,former secretary state mike pompeo wife susan violated federal ethics rules assigning staff personal,0.0
848,a sentenced months federal prison shooting elephant seal head handg,0.0
849,i re roll ain looking dramatic video shrimp boat caught stor,-0.4333333333333333
850,congress soon answers financier jeffrey epstein died suicide bureau prisons custody,0.0
851,i wanna time thank j t soon happened replace nacho,0.0
852,there pieces evidence didn sit detectives reexamined murder,0.0
853,pres biden makes remarks wake recent mass shooting every single day mass shooting un,-0.03571428571428571
854,we support helpful iran saying move enrich 60 p,0.0
855,every single day mass shooting united states pres biden days it national embarrassment,-0.07142857142857142
856,new i ve prioritized gun reform pres biden mass shooting congress step,0.13636363636363635
857,as daunte wright death tears wounds police departments change,0.0
858,new after democrats blasted announcement unusually fierce criticism president own party,0.08409090909090909
859,pres biden announces partnership japan we re prove democracies,0.0
860,happening now pres biden holds joint press conference japanese prime minister h e suga yoshihide,0.0
861,new queen elizabeth shares private photograph the duke edinburgh top coyles muick,0.21212121212121213
862,the mayor minneapolis suburb seen nightly protests contends police overreacting demonstrators,0.0
863,more a shotgun hole home based items observed suspect bedroom time,0.5
864,new in march 2020 suspect mother contacted law enforcement report try commit suicide co,0.13636363636363635
865,witness mass shooting indianapolis fedex facility describes sat eat lunch cowo,0.0
866,just in the suspect killing eight people fedex facility indianapolis former employee acco,0.0
867,in recent officers faced little consequences deemed mistake,-0.09375
868,news forthcoming book sparked immediate backlash social media,0.03333333333333333
869,more rep ilhan omar slams pres joe biden backtracking admitting refugees leaving historically low,0.25
870,pres biden backtracks admitting refugees leaving former pres trump historically low limit s,0.0
871,pres biden faced pressure call forcefully gun control measures noted statement c,0.0
872,raul castro resigning head cuba communist party era formal leadership hi,0.0
873,a black woman doesn poor life stake baby life stake,-0.2833333333333333
874,drone footage captured spring storm brought snow massachusetts prompting winter storm warning,0.0
875,meteorologist receives outpouring support posting social media hearing aids,0.03333333333333333
876,lil nas x answers kids questions means closet,0.0
877,two transgender woman found shot death hotel 11 days apart charlotte north carolina prom,0.0
878,fresh eruption a st vincent captured scene la soufri re volcano erupted wednesday,0.3
879,new oath keepers jon schaffer pleaded guilty multiple felonies including breaching capitol,-0.12121212121212122
880,we re ones segregated sacrifice zones,0.0
881,rt the president issues decades press sec pskai tells executive actio,-0.1
882,spring snow snow fell country bringing foot snow rockies plains,0.0
883,pres biden issues statement following indianapolis mass shooting we act save li,0.0
884,new pres biden flags flown half staff following indianapolis mass shooting weeks i gav,-0.010101010101010102
885,a warehouse fire raged paris suburb aubervilliers nearby road railway lines closed,-0.1
886,their lives suddenly shattered lies uncovered now this mom kids bravely share,0.4
887,new pres biden briefed mass shooting indianapolis fedex facility white house press secreta,0.06818181818181818
888,the sky beijing shrouded orange haze sandstorm hit city officials issued aler,0.0
889,now re re seeing this overall surge gun violence include mass sho,0.0
890,a nor easter bringing heavy snow upstate new york new england,0.024242424242424232
891,new officials indianapolis shooting suspect car pretty quickly started random shootin,0.05492424242424243
892,the note the sanctions broader impact russia economy remains seen if san,0.0
893,officials premature speculate motivation suspect indianapolis mass shooting adding i,0.0
894,we guard resignation despair assumption this simply,0.0
895,breaking officials update mass shooting fedex facility indianapolis left eight dead,-0.1
896,there barriers access this pause,0.0
897,as levels depression rise public health experts typically expect suicide rates follow but studies,-0.08333333333333333
898,teachers students this maryland schoolers decided,0.0
899,daunte wright highlights challenge police reaching stun guns experts,0.0
900,new indiana gov eric holcomb shaken mass shooting fedex facility left eight dead ord,-0.02121212121212122
901,babies born black women u s times infant mortality rate babies born hispanic whit,-0.16666666666666666
902,starting now headlines globe anchors,0.0
903,what fatal police shooting daunte wright,0.0
904,iran enriching uranium friday level edging closer weapons grade levels pressure ta,0.0
905,horror crash a driver involved speed chase police officers smashes truck kid car,0.0
906,at dr fauci told rep jordan i you re this personal isn it,0.0
907,police shot killed individual firing indiscriminately people outside san antonio international,-0.05
908,rt 8 people killed injured mass shooting thursday night fedex facility indianapolis accord,-0.2
909,china friday expressed serious concerns united states japan calls negative mo,-0.31666666666666665
