,text,rating_pt
0,how wyoming vaccine hesitant,0.0
1,this history biggest tragedies life suffer watch,0.0
2,in nevada desert quiet frenzy building rare resource crucial meeting coun,0.09999999999999999
3,people enjoy watching total strangers study youtube,0.2
4,during press run black panther 2018 chadwick boseman spoke significance re,-0.16666666666666666
5,new derek chauvin sentenced killing george floyd june 16,0.13636363636363635
6,number capitol riot arrests military law enforcement government personnel rises 52,-0.1
7,rt monday on it oscars afterparty we you backstage oscar winners recap moments styles,0.0
8,dozens inmates iowa prison overdoses covid 19 vaccine officials,0.0
9,just chance you catch disease spread a tee,0.0
10,more citing urgent vaccinate country quickly government advisory panel recommending natio,0.41666666666666663
11,breaking cdc advisory panel votes resume johnson amp johnson vaccine warning risks read,0.0
12,two profile police using deadly force minnesota history happened roughly 5 miles,-0.15000000000000002
13,covid vaccinations pandemic isn click interactive map u s,0.0
14,jeffrey epstein associate ghislaine maxwell pleads guilty eight count superseding indictment,-0.5
15,if wasn this 17 video derek chauvin likelihood police,0.0
16,people rest beneath 94 foot 21 000 pound model blue whale vaccinated american mus,0.0
17,in flight a skein snow geese flew fields la conner washington ahead annual migration,0.0
18,simone biles athleta entered partnership the gap inc owned activewear company announced,0.0
19,rt on heels fatal police shooting 16 ma khia bryant bush discusses treatment black girls,-0.16666666666666666
20,u s missions overseas fly lgbt pride flag official flagpoles according internal,0.4
21,spectators cheered launch pad falcon rocket carrying astronauts launched orbit fl,0.0
22,new all nine justices supreme court met person time nearly justice amy,0.11818181818181818
23,after derek chauvin conviction george floyd murder doj weighing charging 2017 incident,0.0
24,hitch a ride whale watchers near dana point california spotted seagull catching free ride sunfish,0.3666666666666667
25,former atlanta police officer attorney client didn chance defend,0.0
26,kristin smart parents file lawsuit murder suspect father allegedly moving body,0.057142857142857134
27,you name smiling george floyd family friends share intimate look life,0.2
28,gianna floyd father george floyd call buttercup describes abc2020 interview,0.0
29,more the update comes federal advisers considering johnson amp johnson vaccine injections resu,0.5
30,new cdc 15 confirmed reports blood clots low platelet counts following johnson amp jo,0.1340909090909091
31,we decision quick cdc director this week,0.3333333333333333
32,white sheriff deputy san francisco bay area shot killed black middle busy intersecti,-0.053333333333333344
33,new in white house plans provide american sign language interpretation pres biden address,0.04545454545454545
34,go dog go video captures moment athletic dog sprinted onto track steal,0.0
35,climate activists dumped fake coal outside headquarters insurance company london england protesting,-0.25
36,rt he bottom lines budge individual impacted press sec psaki,-0.05
37,new 42 country pres biden doing little try reform police practices news wap,-0.025568181818181823
38,a spring deep freeze lingers friday morning georgia connecticut dozen freeze frost,0.0
39,rt news exclusive nih director dr francis collins talks pause j amp j vaccine,0.0
40,if wasn this 17 video derek chauvin likelihood police,0.0
41,rt the filibuster jim crow relic bush push senate rule we mandate del,0.0
42,new after derek chauvin conviction george floyd murder doj weighing charging 2017 incide,0.13636363636363635
43,more pres biden overseas trip president june traveling united kingdom belgi,0.5
44,caitlyn jenner files paperwork run governor california taking official step bid compet,0.0
45,rt tonight 20 20 takes deeper look investigation george floyd death trial officer convicted,0.0
46,why reforestation crucial saving environment,0.0
47,spacex falcon 9 pictured liftoff time exposure launch complex 39a kennedy space center,-0.2
48,new pres biden overseas visit president traveling united kingdom belgium ju,0.13636363636363635
49,in nevada desert quiet frenzy building rare resource crucial meeting coun,0.09999999999999999
50,millions americans grounded flying real id deadline,0.2
51,we hope society humanity this 11 colombian environmentalist fellow clim,0.0
52,rt 63 black people minorities receive equal treatment whites criminal justice system,-0.18888888888888888
53,confidence police adequately trained avoid using excessive force reaches low 60 americ,0.027777777777777773
54,the coronavirus conquered world mountain,0.0
55,people enjoy watching total strangers study youtube,0.2
56,royal birthday prince louis son prince william duchess catherine 3,0.0
57,latest the jailed russian opposition leader alexey navalny hunger strike 24 days follow,0.25
58,happening now pres biden speaks virtual summit climate change world leaders the president hoping,0.0
59,alternate juror chauvin trial describes experience i guilty level,-0.25
60,spacex third crew attack helicopter pilot former air france pilot japanese rocket scientist,0.0
61,two profile police using deadly force minnesota history happened roughly 5 miles,-0.15000000000000002
62,starting now headlines globe anchors,0.0
63,study buddies south korea study videos bring camaraderie libraries amid covid 19,0.0
64,a piece copper struck u s mint philadelphia 1794 prototype fledgling na,0.0
65,attempted murder charges filed suspect road rage shooting chicago lake shore drive critically,0.0
66,we virus virus,0.0
67,federal advisers consider johnson amp johnson vaccine injections resume,0.0
68,new imprisoned russian opposition leader alexey navalny hunger strike getting medical,0.04545454545454545
69,spacex falcon 9 rocket carrying crew 2 mission astronauts lifts launch complex 39a kennedy,-0.3
70,new japanese pm yoshihide suga declares third emergency tokyo urban prefectures,0.03409090909090909
71,all of the lights residents alberta canada dazzling light northern lights danced,0.575
72,happening now spacex crew dragon holds post launch news conference,0.0
73,as americans return skies trips county federal officials sounding ala,0.0
74,light up the world a thai buddhist temple sets world record lighting 300 000 candles mark earth day,0.4
75,for outdoor locations lots people wearing mask recommended,0.0
76,marvel movie fans ve missing tom holland spider man films rest mcu movies disney,-0.2
77,fire breaks hospital western india killing 13 covid 19 patients extreme surge infections leave,-0.0625
78,new 42 country pres biden doing little try reform police practices news wap,-0.025568181818181823
79,just in 63 black people minorities receive equal treatment whites criminal justice,-0.18888888888888888
80,breaking confidence police adequately trained avoid using excessive force reaches low 60,0.027777777777777773
81,ready return app stores parler gateway extreme sites critics warn,0.037500000000000006
82,breaking spacex launches astronauts iss recycled rocket capsule,0.0
83,rt overnight spacex launch four astronauts bound international space station manned mission using prev,0.0
84,watch live liftoff scheduled 5 49 et spacex prepares launch astronauts iss,0.13636363636363635
85,hud withdraws trump era policy allowed taxpayer funded homeless shelters deny access transgen,0.0
86,this suggests america moving phase desperate vaccine searches aggressive government,-0.6
87,four astronauts countries set launch florida coast international space station,0.0
88,happening now spacex launch 4 astronauts iss recycled rocket capsule,0.0
89,here this nominated oscars talent land themselves history books,0.0
90,case jeffrey epstein sweetheart deal headed supreme court,0.0
91,remembering daunte wright houston speed artist ange hillz painted portrait daunte wright funeral servi,0.0
92,counterfeit versions pfizer covid 19 vaccine identified mexico poland pfizer spokesperson,0.0
93,a 14 study compared diets american children adults food schools top,0.25
94,number capitol riot arrests military law enforcement government personnel rises 52,-0.1
95,pregnant women covid 19 risk complications death contract virus,0.3333333333333333
96,here eight oscars best picture nominees 93rd academy awards filmed,1.0
97,an experiment converted mars atmosphere breathable oxygen,0.0
98,four astronauts arrive launch pad spacex flight international space station company th,0.0
99,electric vehicles continuing safe gas powered counterparts according data,0.5
100,vanessa bryant kobe bryant estate confirm contract renewed five post,0.0
101,jaguar land rover suspending production u k factories becoming automaker fall vict,0.45
102,the nine civilian victims gunned boulder colorado grocery store month killed polic,-0.2
103,a mail carrier cincinnati received sweetest sendoff day,0.0
104,experts weigh potential harms pausing johnson amp johnson vaccinations,0.0
105,the wandavision star considered dropping name entirely stop compared sisters,0.0
106,california department education public school enrollment dropped 160 000 this academic,0.0
107,drought conditions cover 85 mexico,0.0
108,john travolta losing late wife kelly preston,-0.3
109,the move sharply criticized chapter naacp comes nearly months school preside,-0.012499999999999997
110,kristin smart parents file lawsuit murder suspect father allegedly moving body,0.057142857142857134
111,go dog go video captures moment athletic dog sprinted onto track steal,0.0
112,how wyoming vaccine hesitant,0.0
113,re planting forests planet aid getting earth equilibrium mitigatin,0.0
114,it transformative development city chicago,0.0
115,pres biden usps board nominees aren oust embattled postmaster dejoy insiders,0.0
116,dozens inmates iowa prison overdoses covid 19 vaccine officials,0.0
117,felicity late 90s drama heading television form reboot hints series star sco,-0.3
118,amazon rolling pay palm technology whole foods grocery stores near headquarters payin,0.15000000000000002
119,it estimated 129 billion masks 65 billion gloves monthly unfortunately ppe,-0.5
120,rt secret of the whales look original series national geographic documenting,-0.012500000000000011
121,alternate juror chauvin trial describes experience i guilty level,-0.25
122,a piece copper struck u s mint philadelphia 1794 prototype fledgling na,0.0
123,a bill designed change arizona voting list voted republican led senate,0.0
124,while spring snow unexpected cincinnati zoo amp botanical garden rollicking red pandas en,0.05
125,the empire state building lit green tonight honor earthday,-0.2
126,two profile police using deadly force minnesota history happened roughly 5 miles,-0.15000000000000002
127,bearly there an adorable bear cub rummaging florida resident garbage appeared hide,0.5
128,a bill d c statehood passed house vote 216 208 heads senate 45 co sponsors,0.0
129,sleeping six hours night raise risk dementia 30 study,0.0
130,say their names a art installation remembers 100 african americans died police custody it located,0.0
131,as impact climate change apparent misinformation shifting focus,0.05
132,happening now reports guatemala people leaving homes trying,0.0
133,the la soufri re volcano erupted this morning caribbean island st vincent thousands people ha,0.0
134,rt reports guatemala called dry corridor portion land covering guatemal,-0.06666666666666665
135,i ve got the power thailand constructing world largest hybrid solar hydro power projects massiv,0.0
136,california drought bracing devastating wildfire season,-1.0
137,all of the lights residents alberta canada dazzling light northern lights danced,0.575
138,as americans return skies trips county federal officials sounding ala,0.0
139,four astronauts countries set launch florida coast international space station ea,0.0
140,congratulations former pro wrestler ronda rousey pregnant child,0.16666666666666666
141,here derek chauvin try verdict overturned appeal,0.0
142,pres biden promised tackle climate change here earthday,0.0
143,federal officials sounding alarm looming deadline potentially ground tens,0.0
144,masks remain tool preventing spread indoors outdoors,0.0
145,rt new sen josh hawley lone dissenting vote it broad as former prosecutor view,0.06628787878787878
146,new sen tim scott deliver republican response pres biden joint address congress week,0.13636363636363635
147,rt hud withdraws trump era policy allowed taxpayer funded homeless shelters deny access transgender peo,0.0
148,vaccine day comes shot including potential wait line warm cold,0.0
149,remembering daunte wright houston speed artist ange hillz painted portrait daunte wright funeral servi,0.0
150,an ohio job collect trash pleaded guilty charges related dumping garbage,-0.25
151,i climate crisis earthday,0.0
152,case jeffrey epstein sweetheart deal headed supreme court,0.0
153,prime minister yoshihide suga japan strive 2030 cut emissions 46 2013 levels,0.0
154,racism this country isolated systemic sen amy klobuchar daunte wright funeral,0.0
155,republicans unveil 568 billion infrastructure framework answer pres joe biden expansive 2,0.0
156,his laugh literally contagious daunte wright brother heartfelt reflection funeral i,0.15
157,marvel movie fans ve missing tom holland spider man films rest mcu movies disney,-0.2
158,while breaking logjam remains struggle signs compromise afoot,0.0
159,the absence justice absence peace and re talking violence,-0.0125
160,news examines global climate crisis potential solutions it not too late earth day special,0.01428571428571429
161,re planting forests planet aid getting earth equilibrium mitigatin,0.0
162,my son smile worth million dollars he loved missed daunte,0.4333333333333333
163,we pray attorney general keith ellison allow justice court law attorney ben crump,0.05000000000000002
164,senate votes 94 1 favor amended bill aimed combatting rise anti asian hate crimes,-0.4
165,attorney ben crump leads mourners chant daunte wright life mattered funeral held 20,0.0
166,the european union reached tentative climate deal intended 27 nation bloc climate neutral,0.0
167,on anniversary army specialist vanessa guillen death family gathered washington d c push mem,0.0
168,the nine civilian victims gunned boulder colorado grocery store month killed polic,-0.2
169,proposed bill ban federal law enforcement intelligence agencies buying user data collected smar,0.0
170,zee speaks ceo foundation concrete manmade materials,0.15000000000000002
171,house representatives approves bill nation capital 51st the proposal,0.0
172,comedian eric andre twitter wednesday share alleged racial profiling incident unfolded,-0.1
173,funeral services held daunte wright shot police officer traffic stop brooklyn cen,0.0
174,a stretch beachfront land southern california seized black family 97 ago set,-0.08333333333333333
175,5 oliver caver alabama loves pick trash dad beach inspiring,0.5
176,what learned pres biden 100 days breaks,0.0
177,rt the verdict amp aftermath now this friday night abc2020 shares powerful details interviews story ge,0.3
178,the seen explosion sales digital artworks embraced major aucti,0.03125
179,zee ground silver peak nevada power lithium it not too late eart,-0.3
180,american airlines lost 1 25 billion quarter continued slash costs including dela,0.0
181,governments step lead watch pres joe biden remarks virtual global,0.0
182,artist maliha abidi highlights six women saving planet you earthday,0.0
183,as world emerges grips covid rebuilding global economy provide opportunities investm,0.0
184,police detain 1 200 protesters people dozens russian cities join demonstrations support th,0.0
185,re planting forests planet aid getting earth equilibrium mitigatin,0.0
186,on it not too late earth day special zee speaks young people future planet wa,0.03928571428571429
187,family friends daunte wright 20 black shot dead minnesota police officer gather,-0.18333333333333335
188,the real history earthday story global eco celebration,0.1
189,nasa successfully oxygen mars major development aid future human missions,0.203125
190,our planet warming faster rate recorded zee previews it not too late ear,-0.3
191,we safe equitable,0.5
192,if this re grow lot jobs white house national climate adviser mccarthy tells,0.0
193,hillary clinton taking thriller genre book,0.0
194,sarah goody 16 climate activist founder climatenow breaks biggest pros,0.0
195,walking bearfoot this los angeles resident walking nearly 400 mile journey l a san francisco,0.1
196,watch out woman films dramatic moment narrowly escapes landslide north wales beach police urged,-0.31666666666666665
197,i haunted idea dream motherhood completely slipped fingers,0.1
198,it backtracking earlier proposal allowed democrats appoint majority,0.0
199,he dearly missed doctor victims fatal tesla crash,0.0
200,masks remain tool preventing spread indoors outdoors,0.0
201,say their names a art installation remembers 100 african americans died police custody it located,0.0
202,rt it not too late earth day special special streaming airs tonight 8 et abcne,0.1380952380952381
203,how you ignore 50 population 50 species how you ignore brain meet,0.0
204,weather a late season cold blast moving country this morning record lows snow,-0.44999999999999996
205,public health experts increasingly critical move nationwide pause causing,0.0
206,how wyoming vaccine hesitant,0.0
207,71 woman riding daughter florida interstate 95 suffers gashed forehead turtle smashes,-0.6
208,starting now headlines globe anchors,0.0
209,just in the americans applying unemployment aid fell week 547 000 low pande,0.0
210,dozens inmates iowa prison overdoses covid 19 vaccine officials,0.0
211,watch pres biden delivers introductory remarks virtual climate summit earthday,0.0
212,pres biden announce goal greenhouse gas emissions calling u s 2030 slash emissions,0.0
213,pres biden bringing leaders world meet this moment climate peril,0.0
214,pres biden usps board nominees aren oust embattled postmaster dejoy insiders,0.0
215,italian authorities half dozen public hospital employees investigation abuse office,-0.05555555555555555
216,white house national climate adviser gina mccarthy united states humble this week,-0.1
217,some social media advocates worried wing extremist parler app recruit indivi,0.03333333333333333
218,the daily pace vaccinations nationwide appears flattening decline,0.0
219,it transformative development city chicago,0.0
220,new pres biden seeks slash carbon emissions half 2030,-0.015151515151515152
221,i ve got the power thailand constructing world largest hybrid solar hydro power projects massiv,0.0
222,sheriff deputy shoots kills black executing search warrant north carolina authorities,-0.16666666666666666
223,journalist susan page author biography house speaker nancy pelosi speaker master,0.0
224,investigators found human remains rural pennsylvania search amish teenager,0.0
225,unfortunately i idea security basically excuse limit access expert read,-0.275
226,india reports global record 314 000 infections,0.0
227,where coca money guns people connections local authorities mafia and,0.0
228,angelina jolie change family situation impacted career recent,0.0
229,the european union reached tentative climate deal intended 27 nation bloc climate neutral,0.0
230,sleeping six hours night raise risk dementia 30 study,0.0
231,here derek chauvin try verdict overturned appeal,0.0
232,as impact climate change apparent misinformation shifting focus,0.05
233,allison jean son botham jean fatally shot 2018 spoke presumed george floyd,0.0
234,the department homeland security inspector released report saying dhs legal authority dep,0.2
235,zee speaks ceo foundation concrete manmade materials,0.15000000000000002
236,chinese president xi jinping attend u s led climate change summit invitation pres biden,0.0
237,johnson included major update ongoing battle convince daughter voiced maui 2016 anim,0.0625
238,a statement released behalf bryant family ma khia mother paula respectfully,0.5
239,gator xing an alligator strolled supermarket parking lot north fort myers florida morn,0.0
240,close call dash camera captures moment suv nearly smashed falling tree north carolina,0.1
241,proposed bill ban federal law enforcement intelligence agencies buying user data collected smar,0.0
242,it estimated 129 billion masks 65 billion gloves monthly unfortunately ppe,-0.5
243,supporters opposition leader alexey navalny gathered near kremlin demanding release chanting holdin,0.1
244,if this re grow lot jobs white house national climate adviser mccarthy tells,0.0
245,what learned pres biden 100 days breaks,0.0
246,on it not too late earth day special zee speaks young people future planet wa,0.03928571428571429
247,sarah goody 16 climate activist founder climatenow breaks biggest pros,0.0
248,california drought bracing devastating wildfire season,-1.0
249,rt the birthday wish after 55 days apart 8 corbin ormson birthday wish hospital allowing,0.0
250,zee ground silver peak nevada power lithium it not too late eart,-0.3
251,here eight oscars best picture nominees 93rd academy awards filmed,1.0
252,boaters catch lucky break close encounter rarely seen grey whale bay naples,0.19444444444444442
253,franziska trautmann max steitz founded glass half full 2020 recycled 800 000 pounds,0.09166666666666666
254,vanessa bryant kobe bryant estate confirm contract renewed five post,0.0
255,some women describing temporary changes menstrual cycles taking covid 19 vaccine experts,0.0
256,hands of love nurses fill latex gloves warm water technique called little hands love help covid,0.353125
257,here this nominated oscars talent land themselves history books,0.0
258,artist maliha abidi highlights six women saving planet you earthday,0.0
259,counterfeit versions pfizer covid 19 vaccine identified mexico poland pfizer spokesperson,0.0
260,we continue outraged deaths attorney general merrick garland tells,-0.425
261,investigators found human remains rural pennsylvania search amish teenager,0.0
262,iowa gov kim reynolds urging residents vaccinated covid 19 40 count,0.0
263,rt i feel grown i little kid judeah reynolds 10 witnessed death george floyd speaks,-0.1875
264,it transformative development city chicago,0.0
265,rt tonight the story oscar nominated documentary china doesn you co ancho,0.0
266,journalist susan page author biography house speaker nancy pelosi speaker master,0.0
267,moving moving attorney general merrick garland speaks exclusively dealt wi,0.05000000000000002
268,pres biden seeks reestablish u s leadership climate earth day summit,0.0
269,experts interviewed news if you develop covid 19 if you exposed you probably delay,0.0
270,rt just in our guest host close game 37th season,-0.4
271,roads buildings st vincent covered ash la soufri re volcano erupted the u n anno,0.0
272,while breaking logjam remains struggle signs compromise afoot,0.0
273,he dearly missed doctor victims fatal tesla crash,0.0
274,a stretch beachfront land southern california seized black family 97 ago set,-0.08333333333333333
275,vaccine day comes shot including potential wait line warm co,0.3
276,utah governor defends support nba minority scholarship sponsored utah jazz despite criticism,0.0
277,inspector dhs legal authority deploy officers portland comprehensive strategy,0.2
278,inspector dhs legal authority deploy officers portland comprehensive strategy,0.2
279,police released videos body camera footage incident audio 911 calls police rec,0.0
280,as joe biden prepares host climate change summit earth day office news spoke,0.0
281,the officer fatally shot 16 ma khia bryant identified officials nicholas reardon,0.0
282,tech tinis a robotics firm autonomous bartender complete terrible jokes favo,-0.175
283,happening now live opposition leader alexey navalny protests rock russia watc,0.13636363636363635
284,sleeping six hours night raises risk dementia 30 study,0.0
285,the european union reached tentative climate deal intended 27 nation bloc climate neutral,0.0
286,a conference washington expected move afghanistan warring final peace agreement po,-0.05
287,we ve told recycling green solution planet according experts recycling system,-0.2
288,supporters opposition leader alexey navalny gathered near kremlin demanding release chanting holdin,0.1
289,on it not too late earth day special zee speaks young people future planet wa,0.03928571428571429
290,starry sky a photographer captured beautiful timelapse night sky canada lake winnipeg,0.85
291,narco violence surge peru amazon sends indigenous leader hiding,0.0
292,pres biden we mask goes chance,0.0
293,when tomorrow vaccination today hit 200 million shots,0.0
294,allison jean describes lasting anguish derek chauvin verdict,0.0
295,the superintendent florida school district 17 students staff died 2018 school massacre,0.0
296,watch live pres biden delivers remarks covid 19 vaccinations,0.13636363636363635
297,here derek chauvin try verdict overturned appeal,0.0
298,pres biden invited 40 world leaders participate leaders summit climate held virtua,0.0
299,three improve america recycling,0.0
300,while slow momentum police reform george floyd death activists minnesota gov tim wa,-0.30000000000000004
301,10 girl testified chauvin trial reacts guilty verdict,-0.5
302,rt press sec psaki status george floyd act the stage re leaders hill,-0.1
303,narco violence surge peru amazon sends indigenous leader hiding,0.0
304,pres biden announce 200 million vaccine dose goal met thursday,0.0
305,while isn stop robocalls completely fcc you stop,0.1
306,happening now press sec jen psaki holds white house press briefing,-0.05
307,the president nation largest police union it time honest discussion policing public sa,0.3
