,text,rating_pt
1499,pandemic portraits these beautiful family portraits offer window people lives isolate themselves,0.85
1500,the pentagon police officer charged murder allegedly killing people maryland this week pulled,-0.1
1501,maryland lawmakers gathering override gov larry hogan vetoes police reform measures,0.0
1502,search effort underway missing lsu student car found mississippi river bridge kori gauthier,-0.2
1503,the roasted tomato feta cheese tiktok trend rearview this pan pasta inspired vira,0.0
1504,the car crash involving former kansas city chiefs assistant coach britt reid injured children inclu,0.0
1505,two virginia police officers sued allegedly drawing guns uniformed army officer,-0.1
1506,amazon secured apparent victory efforts quell formation labor union warehouse ala,0.05
1507,president joe biden create commission study changes supreme court including adding seats,0.0
1508,immigrant street vendors hustling survive pandemic,0.0
1509,electronic vaccine proof safer critics fast,0.2
1510,pres joe biden released 1 5 trillion wish list federal budget,0.0
1511,as nation bitterly fractured election rules heart trump country red appears,-0.05
1512,the coffee chain announced borrow return trial program launching five seattle locations allo,0.0
1513,marijuana policy experts advocates this national trend indicative shift americans perspectives,0.0
1514,let tampa officials you 10 foot alligator car,0.0
1515,ben jealous prominent civil rights leader helmed naacp five endorsing democrat jennifer ca,0.5
1516,now streaming hope amp desperation emergency border special anchored,0.35714285714285715
1517,much st vincent remains covered ash following eruptions island la soufriere volcano,0.1
1518,on the edge a tiny medieval town italy nicknamed dying town fighting survival erosion lands,0.0
1519,the note former pres trump influence gop quieter presidency,0.0
1520,light show volcanic lightning seen illuminating night sky st vincent following multiple reported erup,0.13333333333333333
1521,rachael blackmore broken biggest gender barriers sports becoming female jockey,0.016666666666666663
1522,flying free bald eagle released wild montana treated minor injuries,0.15
1523,the funeral britain prince philip husband queen elizabeth ii held april 17 limited 30,-0.07142857142857142
1524,nfts spark debate digital value environmental impact,0.0
1525,an irish photographer taking portraits people locked homes coronavirus pandemic,0.0
1526,under the sea a vlogger films dolphins turtles tropical fish whitetip reef shark swims,0.0
1527,lost taste smell covid 19 a cookbook aims help,0.0
1528,state tv reports iran begun 10 day lockdown amid fourth wave coronavirus infections,0.0
1529,take moment enjoy serene sunrise seabrook island south carolina dolphin glides wav,0.4
1530,a significant era royal history friday death prince philip age 99 here 8,0.375
1531,researchers aren exactly surface except billions,0.25
1532,back home platypus returns wild found injured water treatment facility australia,0.05
1533,family friends celebrities offering condolences wake death iconic rapper dmx,0.5
1534,egypt announces discovery termed lost golden city southern province luxor,0.15
1535,ocean fear a study investigates rising temperatures amid climate change taking toll tropical fish,0.0
1536,you breakthrough infections vaccination you re vaccinating literally tens tens tens,0.0
1537,the famed viral fyre fest sandwich tweet auction nft,0.0
1538,a dog moscow hear winter weather grabbing microphone reporter,0.0
1539,high court halts california coronavirus rules limiting home worship,0.16
1540,gun salutes u k commonwealth countries sea marked death prince philip military le,0.0
1541,now streaming hope amp desperation emergency border special anchored,0.35714285714285715
1542,u s experience 85 drop johnson amp johnson vaccine availability week unlikely steady ou,-0.16666666666666669
1543,in the clouds an ethereal sea clouds appeared mountain peaks rainfall wulingyuan scenic area,0.0
1544,weather millions people waking flooding rain damaging winds tornadoes deep s,0.0
1545,st vincent awaits volcanic explosions help arrives,0.0
1546,roberta jacobson senior white house official overseeing southern border issues stepping,0.0
1547,i sends people prison,0.0
1548,roberta jacobson senior white house official overseeing southern border issues stepping,0.0
1549,airlines pulling dozens boeing 737 max planes service this time inspect,0.0
1550,we platform we raise money,0.0
1551,president joe biden create commission study changes supreme court including adding seats,0.0
1552,police holding riot shields pelted missiles officers charged rioters dogs police,0.0
1553,the week derek chauvin trial wrapped testimony medical examiner completed george,0.0
1554,both countries successful stamping spread covid 19,0.75
1555,sports illustrated feature male model upcoming 2021 swimsuit issue,0.0
1556,the coffee chain announced borrow return trial program launching five seattle locations allo,0.0
1557,u s experience 85 drop johnson amp johnson vaccine availability week unlikely steady ou,-0.16666666666666669
1558,an irish photographer taking portraits people locked homes coronavirus pandemic,0.0
1559,prince philip death age 99 marked seven decade marriage queen elizabeth whom marrie,0.1
1560,the note former pres trump influence gop quieter presidency,0.0
1561,khloe kardashian speaking receiving criticism negative remarks unauthorized photo sur,-0.3
1562,pfizer vaccine maker authorized u s federal regulators authorize vaccine,0.0
1563,the reproductive women u s increasing according study,0.0
1564,tesla ceo elon musk drawing scrutiny questionable comments wall street analysts this,-0.5
1565,one detail don expect ross rachel monica phoebe chandler joey you,0.0
1566,maryland gov larry hogan vetoed police reform measures passed democrat controlled general assembl,0.05000000000000002
1567,prayers answered 16 losing arm horrific car crash this trainee priest pray,-1.0
1568,four dead gray whales washed onto san francisco bay area beaches nine days,-0.2
1569,swift rerecording albums unable buy master recordings six albums fr,-0.5
1570,the cutback ncaa athletic programs due covid 19 pandemic acutely gymnastics,0.2375
1571,an 18 reunited starbucks barista helped mom birth coffee shop restroom,0.0
1572,disneyland avengers campus june 4 here,0.0
1573,the 23 poet perform presidential inauguration featured cover,0.0
1574,citigroup incorporated environmental social governance scores esg securities services dat,0.03333333333333333
1575,in effort provide resources investigate thousands unsolved missing murdered native am,-0.2
1576,the la soufriere volcano located eastern caribbean island st vincent erupted friday morning forcing th,0.0
1577,the social economic fallout coronavirus pandemic disproportionate impact women delay ge,0.11666666666666667
1578,it piece evidence changed involving string grisly murders the kill,0.0
1579,experts vaccines alike matters preventing hospitalizations deaths,0.0
1580,you breakthrough infections vaccination you re vaccinating literally tens tens tens,0.0
1581,president joe biden restored prisoner war missing action flag former location atop white h,-0.025
1582,rt philip serving consort british history serving partner reigning monarch abc news,0.0
1583,americans saved paid debt pandemic stimulus payments according surveys feder,0.0
1584,from tulsa massacre criminal justice reform halls congress nba soulofanation explores,-0.4
1585,the week derek chauvin trial wrapped testimony medical examiner completed george,0.0
1586,roberta jacobson senior white house official overseeing southern border issues stepping,0.0
1587,she learned five murders occurred days vacation quickly drew conne,0.3333333333333333
1588,meme cultural touchstone cheese sandwich,0.1
1589,facebook job ads women run afoul anti discrimination laws,0.0
1590,in view major blow organized labor movement amazon warehouse workers alabama voted,0.0625
1591,egypt announces discovery termed lost golden city southern province luxor,0.15
1592,a 3 000 city largest city found egypt discovered buried beneath sands luxor,0.0
1593,rt this ultimate nightmare our abc2020 starts 9 8c tonight,0.0
1594,rt i am disappointed surprised vote sen bernie sanders amazon warehouse workers alabama vote,-0.325
1595,the united states urging international community concrete action military myanmar,0.0375
1596,now streaming hope amp desperation emergency border special anchored,0.35714285714285715
1597,airlines pulling dozens boeing 737 max planes service this time inspect,0.0
1598,here guide living house windsor,0.0
1599,prince philip laid rest funeral ceremony modified due coronavirus pandemic social distan,-0.04583333333333334
1600,harry meghan paid tribute philip website archewell nonprofit production venture,0.0
1601,the additions u k chester zoo including rhino calf giraffe calf okapi calf able,0.5
1602,rt just in house ethics committee investigation rep matt gaetz,0.0
1603,the significant conditions played role death didn directly cause death,0.2375
1604,u s experience 85 drop johnson amp johnson vaccine availability week unlikely steady ou,-0.16666666666666669
1605,an irish photographer taking portraits people locked homes coronavirus pandemic,0.0
1606,rt the law enforcement subdual restraint neck compression mr floyd virtue heart con,0.0
1607,jill i entire administration send condolences majesty queen elizabeth ii loss pri,0.0
1608,pandemic portraits these beautiful family portraits offer window people lives isolate themselves,0.85
1609,take moment enjoy scenes captured kayaker inside fingal cave isle staff coas,0.4
1610,rt she learned five murders occurred days vacation quickly drew connection wh,0.3333333333333333
1611,a significant era royal history friday death prince philip age 99 here 8,0.375
1612,prince philip death age 99 marked seven decade marriage queen elizabeth whom marrie,0.1
1613,the la soufri re volcano caribbean island st vincent erupted following day seismic activity fo,0.0
1614,more while people sick virus spread unvaccinated adu,-0.10714285714285715
1615,new pfizer vaccine maker authorized u s federal regulators authorize vac,0.13636363636363635
1616,transportation sec pete buttigieg bottom line safety cdc treating,-0.1
1617,transportation sec pete buttigieg bottom line safety cdc treating,-0.1
1618,the note former pres trump influence gop quieter presidency,0.0
1619,now streaming hope amp desperation emergency border special anchored,0.35714285714285715
1620,light show multiple lightning bolts illuminate night sky larned kansas,0.2
1621,the coffee chain announced borrow return trial program launching five seattle locations allo,0.0
1622,in this i believe primary mechanism death asphyxia low oxygen forensic pathologist witness te,0.2
1623,president joe biden create commission study changes supreme court including adding seats,0.0
1624,a storm move gulf coast friday alert risk damaging wi,0.0
1625,volunteers joined forces help gather waste bolivia lake uru uru polluted plastic bottles,-0.2
1626,new former pres barack obama passing prince philip through extraordinary example proved,0.15656565656565655
1627,breaking legendary rapper dmx died age 50 suffering heart attack his family,1.0
1628,a pennsylvania charged assaulting officers u s capitol jan 6 insurrection,0.0
1629,egypt announces discovery termed lost golden city southern province luxor,0.15
1630,new amazon secured apparent victory efforts quell formation labor union warehouse i,0.09318181818181817
1631,john kerry special u s envoy climate bangladesh hear south asia delta nation,0.35714285714285715
1632,ben jealous prominent civil rights leader helmed naacp five endorsing democrat jennifer ca,0.5
1633,just in pres joe biden first lady jill biden send condolences passing prince philip jill i,0.25
1634,as nation bitterly fractured election rules heart trump country red appears,-0.05
1635,this psychological thriller set space entering theaters this week happens heads,0.0
1636,this dynamic duo,0.0
1637,the world looking republican gov jim justice this week there giant urgency,0.0
1638,plumes smoke appeared st vincent grenadines caribbean evacuation issued,0.0
1639,free and clear endangered sea turtles released waters mediterranean sea,0.25
1640,it scoring culture wars democratic rep boog highberger lawrence home,0.0
1641,new a pentagon force protection agency police officer duty time fatal shooting maryland,0.13636363636363635
1642,streets of rage riot police water cannons disperse violent crowds seventh night unrest belfa,-0.8
1643,news special report witnesses stand trial derek chauvin ex officer charged death g,0.35714285714285715
1644,in a minute a look life prince philip 60,0.0
1645,a russian u s trio space travelers launched successfully friday heading international space station,0.25
1646,prince philip family leaders world reflected 99 life leg,0.0
1647,prince philip duke edinburgh carried public engagement july 22 2020 handing role,0.0
1648,prince philip death friday age 99 marked seven decade marriage queen elizabeth whom,0.1
1649,a plaque placed outside buckingham palace london england following announcement prince philip dea,0.0
1650,a flag lowered half staff buckingham palace following announcement death prince philip duk,-0.08333333333333333
1651,the announcement prince philip duke edinburgh death posted outside buckingham palace,0.0
1652,you breakthrough infections vaccination you re vaccinating literally tens tens tens,0.0
1653,u k prime minister boris johnson nation mourns following death duke edinburgh prince phili,0.0
1654,a significant era royal history friday death prince philip age 99 here 8,0.375
1655,lift off a russian u s trio space travelers launches successfully baikonur cosmodrome kazakhstan head,0.375
1656,we look life prince philip duke edinburgh passed 99,0.0
1657,i sends people prison,0.0
1658,sen joe manchin reaffirmed proposed changes senate filibuster rule support shortc,0.0
1659,breaking britain prince philip stalwart supporter wife queen elizabeth ii seven decades ha,0.0
1660,just in prince philip stalwart supporter wife queen elizabeth ii seven decades died he,0.0
1661,breaking prince philip duke edinburgh died age 99 buckingham palace announces,0.0
1662,news special report prince philip died age 99 buckingham palace announces,0.35714285714285715
1663,she happiest baby entire world despite mom francesca garnett,0.0
1664,one witness healthy person died chauvin restraint,0.5
1665,the famed viral fyre fest sandwich tweet auction nft,0.0
1666,americans saved paid debt pandemic stimulus payments according surveys feder,0.0
1667,experts vaccines alike matters preventing hospitalizations deaths,0.0
1668,the brent spence bridge kentucky ohio symbol local priorities popular rep,0.3
1669,bosnia seeing rise coronavirus infections migrants refugees living camps struggles,0.0
1670,the intelligence branch dhs warning foreign adversaries domestic extremists derek chauvi,-0.0625
1671,marijuana policy experts advocates this national trend indicative shift americans perspectives,0.0
1672,this 2 excited birdwatching,0.375
1673,alcohol related liver disease rise young women amid increased pandemic drinking,0.05
1674,the lights life i able close husband time th,0.5
1675,with obesity rise diet tailored genes experts,0.0
1676,the 23 poet perform presidential inauguration featured cover,0.0
1677,with covid 19 pandemic drawing attention america obesity growing body research indicate,0.0
1678,it time lean state rep park cannon makes remarks wake charges dropped kn,0.0
1679,biden administration increasing calls stop companies greenwashing,0.0
1680,microsoft linkedin aim support skills based hiring steps global initiative,0.0
1681,sound on a team model train enthusiasts bagged world record lockdown project creating model,0.4
1682,immigration authorities arrested detained 172 000 migrants southwest border month accordi,0.0
1683,a arrested allegedly attacking asian americans separate occasions new york city polic,0.012121212121212116
1684,biden admin surge aid central america offer legal paths stem historic migration,0.06666666666666667
1685,former reading rainbow host levar burton jeopardy host,0.0
1686,dolly parton mourning loss beloved family helped launch career singer songwrit,0.7
1687,drought conditions west severe officials worried potential fire season,0.0
1688,will smith martin lawrence transformed iconic characters celebrate 26th anniversary,0.5
1689,my big fat greek wedding rom com trilogy star writer nia vardalos confirmed,0.13333333333333333
1690,the goldbergs marked final appearance george segal pops character touching montage featuring,0.19999999999999998
1691,covid miracle hospital staff claiming victory standing ovation 104 woman defi,0.0
1692,starbucks initiative simple concept help reduce single plastic simply sip return re,-0.023809523809523808
1693,iran hit coronavirus infection record third straight day country grapples severe spike,0.1
1694,parts tennessee tornado warnings thursday reported twister touching near town,0.3
1695,khloe kardashian speaking receiving criticism negative remarks unauthorized photo sur,-0.3
1696,target spend total 2 billion black owned businesses 2025 effort advance,-0.08333333333333333
1697,egypt announces discovery termed lost golden city southern province luxor,0.15
1698,rt together again reports virginia jack byrne couple married 72 finally reunited afte,0.125
1699,costs climbing groceries staple online stores due changes amid pandemic th,-0.125
1700,sports illustrated feature male model upcoming 2021 swimsuit issue,0.0
1701,the nba alum recently shopping pair earrings noticed young agonizing finance,0.05
1702,rt guatemalan pres tells migrants fleeing u s amid poverty violence lost,0.0
1703,experts warn significant role women play terrorism extremism world drastically,0.375
1704,former vice pres mike pence memoir set 2023 release,0.0
1705,rt we don lose lives unaccompanied minors talk abc news,0.0
1706,transforming crop timber production sustainable model reduce extinction species mitigating,0.0
1707,israelis silent standstill minute siren wails country remembrance holocaust,0.0
1708,rt abc news chief white house correspondent reports current humanitarian crisis unfolding u s,0.0
1709,the accused strangling california serial killer i 5 strangler won death penalt,0.0
1710,an attendee fyre festival rose overnight internet notoriety appetizing snapshot,0.4
1711,the reproductive women united states increasing according study,0.0
1712,a world renowned pulmonologist testified george floyd died lack oxygen brain resulting,0.0
1713,officials caribbean island st vincent major eruption imminent mandatory evacua,0.0625
1714,a smack jellyfish experts rhizostoma pulmo biggest found mediterranean,0.0
1715,sen joe manchin reaffirmed proposed changes senate filibuster rule support shortc,0.0
1716,as prosecutors associate rep gaetz cooperate government plea deal associate,0.0
1717,latest bryan police believe suspect custody the person custody employee compa,0.5
1718,immigration american issue border issue abc news,0.0
1719,as derek chauvin murder trial continues minneapolis dhs intelligence branch warns foreign adversaries,-0.125
1720,breaking six people shot killed cabinet business bryan texas outside colleg,-0.1
1721,citigroup incorporated environmental social governance scores esg securities services dat,0.03333333333333333
1722,more the suspect according bryan police department,0.5
1723,developing there victims shooting office bryan texas outside college stati,0.0
1724,the brent spence bridge kentucky ohio symbol local priorities popular rep,0.3
1725,the intelligence branch dhs warning foreign adversaries domestic extremists derek chauvi,-0.0625
1726,freedom flight an aegean airlines plane drew flight path reading 200 greece mark 200,0.0
1727,latest phillip adams suspect mass shooting left five people dead home south carolina,0.09999999999999999
1728,americans saved paid debt pandemic stimulus payments according surveys feder,0.0
1729,the tokyo olympic torch relay run streets osaka prefecture week rising covi,0.0
1730,the cdc return sailing framework requires cruise lines submit detailed plans handle pos,0.4
1731,afghanistan trying inoculate millions children polio pandemic lockdowns stalled effort,0.0
1732,rt check interview president guatemala tonight special hour immigration hope amp desperatio,0.35714285714285715
1733,cheers a 104 woman round applause hospital staff heads home beating covid 19,-0.2
1734,in months five legalized recreational marijuana meaning 30 country allows i,0.0
1735,amanda gorman poet perform presidential inauguration featured cover,0.0
1736,rt new majority leader schumer calls biden gun executive actions significant steps statement this afternoon,0.2556818181818182
1737,it time lean state rep park cannon makes remarks wake charges dropped kn,0.0
1738,more 3 600 u s health care workers perished pandemic according investi,0.5
1739,rt press sec pskai pres biden former pres obama remain close friends talk regularly range issu,-0.03333333333333333
1740,grammy award winning musician pharrell williams called federal investigation fatal police shooti,0.5
1741,with covid 19 pandemic drawing attention america obesity growing body research indicate,0.0
1742,sound on thunder rumbles lightning illuminates dark sky goodbee louisiana severe storms stat,0.125
1743,georgia rep park cannon democrat arrested knocking republican georgia gov brian kemp,0.0
1744,attorney general garland steps combat gun violence first ensure understand,0.15000000000000002
1745,pres biden owning weapons the idea bizarre suggest re recommending contr,0.4
1746,pres biden whether congress acts i resources disposal president,0.0
1747,a 17 lamborghini driver facing charges nearly months southern california crash claimed,0.05
1748,pres biden criticizes congressional inaction gun reform enough prayers time action,0.05
1749,pres biden today i proud nominate david chipman serve director aft,0.8
1750,pres biden touts red flag laws response gun violence stating half suicides involve,-0.08333333333333333
1751,in remarks gun violence pres biden decries psychological damage children live ci,0.06818181818181818
1752,a coalition civic participation filed federal lawsuit challenging provisions georgia,0.5
1753,more robert lesslie victims doctor rock hill spent emer,0.2
1754,five people dead including children following shooting home rock hill south carolina wedne,-0.1
1755,pres biden speaks signing executive gun reform gun violence this country epidemic,0.0
1756,rt pres biden speaks signing executive gun reform gun violence this country epidemic,0.0
1757,tonight join hope amp desperation emergency border special anchored im,0.35714285714285715
1758,save the grapes winemakers chablis light thousands torches protect vineyards freezing overnigh,0.4
1759,llama drama an orphaned baby alpaca born damaged legs lease life thanks farmer,0.2
1760,mount sinai hospital new york launching covid 19 saliva testing program prove game chang,-0.13181818181818183
1761,autopsy bowling green university sophomore rules death accident fatal ethanol intoxication,-0.2
1762,despite heavy seas joint norwegian dutch salvage operation managed abandoned dutch cargo ship unde,-0.1
1763,immigration authorities arrested detained 172 000 migrants southwest border month accordi,0.0
1764,state rep park cannon speaks following dismissal charges arrested knocking governor,0.0
1765,home security camera footage captures moment explosion columbus paint manufacturing plant lit sk,0.0
1766,rt georgia rep park cannon passionately speaks following dismissal charges i vow you i knoc,-0.025
1767,news special report witnesses stand trial derek chauvin ex officer charged death g,0.35714285714285715
1768,georgia rep park cannon i knocked door i remembered lives lost,0.0
1769,brian kemp sat office surrounded ol boys signed law racist,0.0
1770,ga lawmaker park cannon georgia sweeping election law as terrible suppressive,-1.0
1771,more mysterious pneumonia sickened workers seafood market china scientists,0.25
1772,a arrested allegedly attacking asian americans separate occasions new york city polic,0.012121212121212116
1773,rt tonight join hope amp desperation emergency border special anchored immigrati,0.35714285714285715
1774,the accused strangling california serial killer i 5 strangler won death penalt,0.0
1775,weather as storm system moves south this morning tornado warnings issued missi,0.0
1776,texas child welfare officials received reports alleging abuse neglect san antonio coliseum,0.0
1777,starting now headlines globe anchors,0.0
1778,rioters set hijacked bus fire hurled gasoline bombs police belfast spate nights,0.0
1779,rescue workers thailand freed buddhist monk trapped inside flooded cave days visiting,-0.2
1780,new addition a dutch zoo welcomed baby rhinoceros estimated weigh 120 pounds born easter morning,0.13636363636363635
1781,tonight join hope amp desperation emergency border special anchored im,0.35714285714285715
1782,park ouch australian police speak appeared practicing parkour building,0.0
1783,the biden administration surge humanitarian assistance central american countries offer,0.0
1784,pres biden preparing unveil series executive actions aimed addressing gun violence delivering,0.0
1785,israelis silent standstill minute siren wails country remembrance holocaust,0.0
1786,one study international consumer protection found 40 company claims sustainabili,0.0
1787,scientists believe combat deadly variants future pandemics,-0.1
1788,parade worthy of royals nearly century half entering egypt labeled salted fish due obscu,-0.021666666666666667
1789,former vice president mike pence book deal,0.0
1790,experts warn significant role women play terrorism extremism world drastically,0.375
